[
  {
    "id": "pdf-editor",
    "title": "PDF編集ツール",
    "category": "社内運営",
    "type": "HTMLアプリ",
    "description": "PDFの結合・編集・変換を簡単に",
    "url": "./apps/pdf-editor/index.html",
    "thumbnailType": "pdf",
    "thumbnailImage": "assets/thumbnails/pdf-editor.png",
    "iconType": "pdf",
    "badge": "人気",
    "tags": [
      "HTMLアプリ",
      "社内運営",
      "PDF"
    ],
    "status": "公開中",
    "featured": true,
    "favoriteEnabled": true,
    "detailEnabled": true,
    "primaryActionLabel": "開く",
    "updatedAt": "2026-06-22",
    "audience": "社内スタッフ、事務担当",
    "summary": "PDFの結合、分割、変換、ページ整理をブラウザ上で行うための社内ツール。",
    "thumbnailFocus": "左ページ一覧、中央PDFプレビュー、上部ツールバー"
  },
  {
    "id": "seats-app",
    "title": "座席管理アプリ",
    "category": "塾事業",
    "type": "HTMLアプリ",
    "description": "教室の座席配置と出欠を一元管理",
    "url": "./apps/seats/index.html",
    "thumbnailType": "seats",
    "thumbnailImage": "assets/thumbnails/seats-app.png",
    "iconType": "seats",
    "badge": "おすすめ",
    "tags": [
      "HTMLアプリ",
      "塾事業",
      "教室運営"
    ],
    "status": "公開中",
    "featured": true,
    "favoriteEnabled": true,
    "detailEnabled": true,
    "primaryActionLabel": "開く",
    "updatedAt": "2026-06-22",
    "audience": "教室長、講師、受付スタッフ",
    "summary": "教室の座席配置、出欠状況、利用状況を見える化する座席管理アプリ。",
    "thumbnailFocus": "色分けされた座席マップ、黒板、左設定パネル"
  },
  {
    "id": "quiz-maker",
    "title": "小テスト作成",
    "category": "塾事業",
    "type": "HTMLアプリ",
    "description": "オリジナル小テストを簡単作成・出力",
    "url": "./apps/quiz-maker/index.html",
    "thumbnailType": "quiz",
    "thumbnailImage": "assets/thumbnails/quiz-maker.png",
    "iconType": "quiz",
    "badge": "NEW",
    "tags": [
      "HTMLアプリ",
      "塾事業",
      "教材"
    ],
    "status": "公開中",
    "featured": false,
    "favoriteEnabled": true,
    "detailEnabled": true,
    "primaryActionLabel": "開く",
    "updatedAt": "2026-06-22",
    "audience": "教室長、講師",
    "summary": "問題を選択・編集し、小テストとして出力する教材作成ツール。",
    "thumbnailFocus": "問題一覧、配点、編集/複製/削除、作成・出力ボタン"
  },
  {
    "id": "attendance-app",
    "title": "勤怠管理",
    "category": "社内運営",
    "type": "HTMLアプリ",
    "description": "出退勤の記録・集計を効率化",
    "url": "./apps/attendance/index.html",
    "thumbnailType": "attendance",
    "thumbnailImage": "assets/thumbnails/attendance-app.png",
    "iconType": "attendance",
    "badge": "",
    "tags": [
      "HTMLアプリ",
      "社内運営",
      "勤怠"
    ],
    "status": "公開中",
    "featured": false,
    "favoriteEnabled": true,
    "detailEnabled": true,
    "primaryActionLabel": "開く",
    "updatedAt": "2026-06-22",
    "audience": "小規模事業者、店長、事務担当",
    "summary": "出退勤、修正申請、打刻漏れ、月末締めを支援する勤怠管理アプリ。",
    "thumbnailFocus": "勤怠一覧表、出勤時間、退勤時間、ステータスチップ"
  },
  {
    "id": "subsidy-template",
    "title": "補助金テンプレート",
    "category": "コンサル事業",
    "type": "テンプレート",
    "description": "補助金申請書を効率的に作成",
    "url": "./templates/subsidy/index.html",
    "thumbnailType": "document",
    "thumbnailImage": "assets/thumbnails/subsidy-template.png",
    "iconType": "document",
    "badge": "おすすめ",
    "tags": [
      "テンプレート",
      "コンサル事業",
      "補助金"
    ],
    "status": "公開中",
    "featured": true,
    "favoriteEnabled": true,
    "detailEnabled": true,
    "primaryActionLabel": "開く",
    "updatedAt": "2026-06-22",
    "audience": "コンサル担当、補助金支援担当",
    "summary": "補助金申請書に必要な項目を整理し、作成を効率化するテンプレート。",
    "thumbnailFocus": "文書ページ、見出し、申請情報の箇条書き"
  }
]
