{
  "id": "",
  "title": "",
  "category": "",
  "type": "HTMLアプリ",
  "description": "",
  "url": "",
  "thumbnailType": "generic",
  "thumbnailImage": "",
  "iconType": "generic",
  "badge": "",
  "tags": [],
  "status": "公開中",
  "featured": false,
  "favoriteEnabled": true,
  "detailEnabled": true,
  "primaryActionLabel": "開く",
  "lastUsedAt": "",
  "updatedAt": "",
  "audience": "",
  "summary": "",
  "thumbnailFocus": "",
  "sourceHtml": "",
  "mockImage": ""
}
